level,colour,cost,trigger,power,soul,traits,series_id,name,jap_name,eng_text,eng_text2,jap_text,jap_text2,type,unique_identifier
3,Blue,2,1,10000,2,Avatar 《アバター》Weapon 《武器》,1,Kirito & Asuna,キリト＆アスナ,"【C】During your opponent's turn, this card gets +1000 Power.","【A】When this card is being Front Attacked, look at the top card of your Deck, place it on top of the Deck or into Waiting Room.
【S】［①］Until the end of your opponent's next turn, this card gets +1000 Power.",【永】 相手のターン中、このカードのパワーを＋1000。,"【自】 このカードがフロントアタックされた時、あなたは自分の山札を上から1枚見て、山札の上か控え室に置く。
【起】［①］ 次の相手のターンの終わりまで、このカードのパワーを＋",Character,SAO/S20-104 TD
1,Yellow,0,0,5000,1,Avatar 《アバター》Weapon 《武器》,1,"Asuna, Infiltrating Underground Dungeon",地下ダンジョンへの潜入 アスナ,"【A】ACCELERATE［Place the top card of your Deck into Clock］At the beginning of your Climax Phase, you may pay the cost. If you did, during this turn, this card gets +3500 Power.",N/A,【自】 加速 ［あなたの山札の上から1枚をクロック置場に置く］ あなたのクライマックスフェイズの始めに、あなたはコストを払ってよい。そうしたら、そのターン中、このカードのパワーを＋3500。,N/A,Character,SAO/S20-105 TD
1,Yellow,0,0,4500,1,Avatar 《アバター》Weapon 《武器》,2,Asuna's Positive Feelings,前向きな気持ち アスナ,"【A】［①］ When this card attacks, if 「“奥さん”の正体」 is in the Climax Slot, you may pay the cost. If you did, choose 1 of your opponent's Character, return it to Hand.","【A】 ACCELERATE ［Place the top card of your Deck into Clock］ At the beginning of your Climax Phase, you may pay the cost. If you did, during that turn, this card gets +3500 Power.",【自】［①］ このカードがアタックした時、クライマックス置場に「“奥さん”の正体」があるなら、あなたはコストを払ってよい。そうしたら、あなたは相手のキャラを1枚選び、手札に戻す。,【自】 加速 ［あなたの山札の上から1枚をクロック置場に置く］ あなたのクライマックスフェイズの始めに、あなたはコストを払ってよい。そうしたら、そのターン中、このカードのパワーを＋3500。,Character,SAO/S26-001 RR
3,Yellow,2,1,10000,2,Avatar 《アバター》Weapon 《武器》,2,"Beacon of Hope, Asuna",希望の光 アスナ,"【A】 This ability can only be activated once each turn. During the turn this card is placed on Stage from Hand or through 『CHANGE』, when the damage dealt by this card is cancelled, you may deal 1 Damage to your opponent. （Damage can be cancelled）","【A】 When this card attacks, if 「世界樹》の上で"">《世界樹》の上で」 is in the Climax Slot, all your Characters, during that turn, get +5000 Power and gain the following ability. 『【A】 When this card's battle opponent becomes REVERSE, place that Character into Stock.』",【自】 この能力は1ターンにつき1回まで発動する。このカードが手札からか『チェンジ』で、舞台に置かれたターン中、このカードの与えたダメージがキャンセルされた時、あなたは相手に1ダメージを与えてよい。（ダメージキャンセルは発生する,【自】 このカードがアタックした時、クライマックス置場に「《世界樹》の上で」があるなら、あなたのキャラすべてに、そのターン中、パワーを＋5000し、次の能力を与える。『【自】 このカードのバトル相手が【リバース】した時、あなたはそのキャラをストック置場に置く。』,Character,SAO/S26-002 RR
0,Yellow,0,0,1000,1,Avatar 《アバター》Weapon 《武器》,2,Asuna's Special Moment,大切な時間 アスナ,"【C】 During your turn, all your other Characters get +500 Power.","【S】 ［REST 2 of your Characters］ Choose 1 of your 《アバター》 Character, during that turn, it gets +1000 Power.",【永】 あなたのターン中、他のあなたのキャラすべてに、パワーを＋500。,【起】［あなたのキャラを2枚【レスト】する］ あなたは自分の《アバター》のキャラを1枚選び、そのターン中、パワーを＋1000。,Character,SAO/S26-003 R
1,Yellow,1,0,6000,1,Avatar 《アバター》Weapon 《武器》,2, Asuna's Gentle Appearance,優しい佇まい アスナ,"【C】 During your turn, for each of your other REST Character, this card gets +500 Power.","【A】 ENCORE ［Place the top card of your Deck into Clock］ (When this card is placed into Waiting Room from Stage, you may pay this cost. If you do, place this card in its previous slot in REST)",【永】 あなたのターン中、他のあなたの【レスト】しているキャラ1枚につき、このカードのパワーを＋500。,【自】 アンコール ［あなたの山札の上から1枚をクロック置場に置く］ （このカードが舞台から控え室に置かれた時、あなたはコストを払ってよい。そうしたら、このカードがいた枠に【レスト】して置く）,Character,SAO/S26-010 U
2,Yellow,1,1,7500,1,Avatar 《アバター》Weapon 《武器》,2,Asuna In a Birdcage,鳥かごの中 アスナ,"【C】 If you have other 「二つの世界 キリト」, this card gets +2000 Power.",N/A,【永】 他のあなたの「二つの世界 キリト」がいるなら、このカードのパワーを＋2000。,N/A,Character,SAO/S26-005 R
2,Yellow,1,1,7500,1,Net 《ネット》,2,Asuna Yuuki,結城 明日奈,"【A】 When this card is placed on Stage from Hand, choose 1 of your Character, during that turn, it gets +500 Power.","【A】 CHANGE ［② Place 1 card into Waiting Room from Hand, place this card into Waiting Room］ At the beginning of your Climax Phase, you may pay the cost. If you did, choose 1 「希望の光 アスナ」 from your Waiting Room, place it into this card's previous slot.",【自】 このカードが手札から舞台に置かれた時、あなたは自分のキャラを1枚選び、そのターン中、パワーを＋500。,【自】 チェンジ ［② 手札を1枚控え室に置き、このカードを控え室に置く］ あなたのクライマックスフェイズの始めに、あなたはコストを払ってよい。そうしたら、あなたは自分の控え室の「希望の光 アスナ」を1枚選び、このカードがいた枠に置く。,Character,SAO/S26-006 R
0,Yellow,0,0,1000,1,Avatar 《アバター》Weapon 《武器》,2,Bride of the Fairy King Asuna,妖精王の妃 アスナ,"【A】 BOND／「二つの世界 キリト」 ［①］ （When this card is played onto Stage, you may pay the cost. If you did, choose 1 「二つの世界 キリト」 from your Waiting Room, return it to Hand）",N/A,【自】 絆／「二つの世界 キリト」 ［①］ （このカードがプレイされて舞台に置かれた時、あなたはコストを払ってよい。そうしたら、あなたは自分の控え室の「二つの世界 キリト」を1枚選び、手札に戻す）,N/A,Character,SAO/S26-007 U
0,Yellow,0,0,2500,1,Avatar 《アバター》Weapon 《武器》,2,Living Legend Heathcliff,“生ける伝説”ヒースクリフ,"【A】 When this card is placed on Stage from Hand, during that turn, this card gets +1500 Power.",N/A,【自】 このカードが手札から舞台に置かれた時、そのターン中、このカードのパワーを＋1500。,N/A,Character,SAO/S26-008 U
